{
  "schema": 1,
  "job_id": "plant-id-eval",
  "workload": "vision-eval",
  "executor": "device",
  "backend": "litert",
  "model": { "name": "plantnet-resnet18-int8", "format": "tflite", "quant": "int8", "sha256": "e3b0c44298fc1c149afbf4c8996fb92427ae41e4649b934ca495991b7852b855" },
  "params": { "input_sha256": "e3b0c44298fc1c149afbf4c8996fb92427ae41e4649b934ca495991b7852b855", "max_items": 120 },
  "targets": { "match": "os ~ 'android' && ram_mb >= 3000" },
  "constraints": { "require_charging": true }
}
