{
  "schema": 1,
  "job_id": "asr-eval",
  "workload": "speech-eval",
  "executor": "device",
  "backend": "whisper.cpp",
  "model": { "name": "whisper-tiny-en", "format": "gguf", "quant": "Q5_1", "sha256": "e3b0c44298fc1c149afbf4c8996fb92427ae41e4649b934ca495991b7852b855" },
  "params": { "input_sha256": "e3b0c44298fc1c149afbf4c8996fb92427ae41e4649b934ca495991b7852b855", "max_items": 50 },
  "targets": { "match": "ram_mb >= 4000" },
  "constraints": { "require_charging": true }
}
