{
  "schema": 1,
  "job_id": "pipeline-triage",
  "workload": "pipeline",
  "executor": "device",
  "backend": "llama.cpp",
  "model": { "name": "qwen2.5-0.5b", "format": "gguf", "quant": "Q4_K_M", "sha256": "e3b0c44298fc1c149afbf4c8996fb92427ae41e4649b934ca495991b7852b855" },
  "params": { "topic": "reviews.incoming", "max_tokens": 128 },
  "targets": { "match": "ram_mb >= 4000" },
  "lease": { "ttl_s": 3600 }
}
