{
  "schema": 1,
  "job_id": "ui-nightly-ios",
  "workload": "ui-test",
  "executor": "host",
  "app": { "name": "your-app-ios", "build": "nightly", "sha256": "latest", "platform": "ios" },
  "suite": { "kind": "xcuitest", "flows": "YourAppUITests-Runner.app" },
  "targets": { "executor": "mac-xcode", "exclusive": true },
  "lease": { "ttl_s": 2400 }
}
